{
  "name": "GlassfishColumnizer",
  "version": "1.0.0",
  "author": "LogExpert Team",
  "description": "Specialized columnizer for Glassfish application server log format",
  "apiVersion": "1.0",
  "requires": {
    "logExpert": ">=1.10.0",
    "dotnet": ">=8.0"
  },
  "permissions": [
    "filesystem:read",
    "config:read"
  ],
  "dependencies": {},
  "main": "GlassfishColumnizer.dll",
  "url": "https://github.com/LogExperts/LogExpert",
  "license": "MIT"
}
