{
  "name": "JsonColumnizer",
  "version": "1.0.0",
  "author": "LogExpert Team",
  "description": "Parses JSON formatted log files, extracting properties as columns",
  "apiVersion": "1.0",
  "requires": {
    "logExpert": ">=1.10.0",
    "dotnet": ">=8.0"
  },
  "permissions": [
    "filesystem:read",
    "config:read"
  ],
  "dependencies": {
    "Newtonsoft.Json": "13.0.0"
  },
  "main": "JsonColumnizer.dll",
  "url": "https://github.com/LogExperts/LogExpert",
  "license": "MIT"
}
