{
  "name": "FlashIconHighlighter",
  "version": "1.0.0",
  "author": "LogExpert Team",
  "description": "Visual highlighter plugin that flashes the LogExpert icon when specific log patterns are detected",
  "apiVersion": "1.0",
  "requires": {
    "logExpert": ">=1.10.0",
    "dotnet": ">=8.0"
  },
  "permissions": [
    "config:read"
  ],
  "dependencies": {},
  "main": "FlashIconHighlighter.dll",
  "url": "https://github.com/LogExperts/LogExpert",
  "license": "MIT"
}
